Result,Text,Title
yes,"ışısuch as waking up at 05:30 with high palpitations and anxiety, feeling of hopelessness, crying spells, a numb body, loss of appetite, rapid weight loss, intense guilt...Then comes a period of isolation. I've learned that 1) don't stop taking your medication, 2) medication only suppresses your fears and anxiety, it's not a cure, 3) find a hobby, but don't rely on it, 4) during anxiety attacks, don't fight your body, relax and wait for it to pass, 5) don't explain your illness to someone who doesn't have anxiety disorder",yaygin anksiyete bozuklugu
yes,"zor, çok bir hastalıktır ancak diğer hastalıklarda olmayan çok enteresan bir iyi yanı vardır. bu namert yüzünden olan, olmayan, olacak olan, olacak olmayan hatta bu evrende gerçekleşme ihtimali olmayan her şeyden endişe duyarsın.",yaygin anksiyete bozuklugu
yes,her anksiyete atağımda 'ölücez zaten be boşver' diye düşünüyorum,yaygin anksiyete bozuklugu
yes,kalp çarpıntısı titreme nefes yetmiyor hissi salonda volta attım 1 saat beni arada bir yakalıyor böyle ama çok yoruyor. ağlama krizleri falan çok yordu be yıllardır çekiyorum ilaç kullansamda yok . ayaklarım hala buz gibi kaslarım gergin hafif uyku hali .tamam diyorum bitti ölüyorum ben kalp krizi bu ya da beyin kanaması diyorum kafamda ne senaryolar anlatamam.,yaygin anksiyete bozuklugu
yes,"rahim rahatsız. devamli icim sıkılıyodu, biraz agladigimda rahatlayabiliyordum. icim sıkılıyo der aglardim... zaten hep ilac kullanan ben, gece ilaci ve ilave xanax a basladim. mesela suanda da sirtim su gibi ve inanilmaz icim sikiliyo, geceleri ilacsiz uyumak mumkun degil, ilac icmeme ragmen 2 saat sonra zınk diye uyaniyorum, bacaklarim devamli kasilmaktan hep agriyo, hep uykuluyum, insanlar anlamiyorlar, işe olu gibi gidiyorum, cocugumla ilgilenecek takatim yok.",yaygin anksiyete bozuklugu
yes,"kronik baş ağrısı, baş dönmesi hissi, sürekli sersemlik hissi, boşlukta yürüyormuş hissi, felaket senaryoları, sindirim sistemi hastalıkları, baygınlık hissi, terleme, üşüme, çarpıntı",yaygin anksiyete bozuklugu
yes,anksiyete bu hastalıkları tetikleyebilir veya olanı daha da kötüleştirebilir.,yaygin anksiyete bozuklugu
yes,"sokaklarda falan salya sümük ağlayabiliyosunuz. ... çocuğa bunlar denir mi ya, sürekli evde biri ölecek diye bekler dururdum. şimdi araba kullanamıyorum, yüzemiyorum. spor ve yoga bir nebze azaltıyor ama.",yaygin anksiyete bozuklugu
yes,"zirve yaptığı bir dönemdeyim. mide ağrısından hareket edemiyorum. evden çıkmıyorum, insanlarla kötü iletişim kurmama sebep oluyor.",yaygin anksiyete bozuklugu
yes,hayatı hapiste geçtikten sonra dışarı çıkan esaretin bedeli filmindeki brooks gibi hissediyorum..çay bardağı da tutamıyorum artık. düşürürüm diye..her şeyden korkar oldum. sonunda tam izolasyon veya intihar ile bu iş çözülecek.,yaygin anksiyete bozuklugu
yes,"en az altı ay boyunca hemen hemen her gün ortaya çıkan bir çok olaya ya da etkinlik hakkında aşırı anksiyete ve gerginlik duyma, kişinin üzüntüsünü kontrol etmeyi güç bulması ve bunlara ek olarak huzursuzluk, kolay yorulma, zihinsel yoğunlaşma güçlüğü, irritability, kas gerginliği, uyku bozuklukları gibi bulguların eşlik edebildiği bir bozukluk olarak tanımlanabilir.",yaygin anksiyete bozuklugu
yes,karışık anksiyete ve depresif bozukluk... psikiyatri eklendi. az buçuk tırsmıyor değilim çünkü engelli raporunda psikiyatri ibaresi olunca milletimiz sorunlu bu damgasını yapıştırıyor,yaygin anksiyete bozuklugu
yes,bu zıkkımın en etkili ilacı ilaç kombinasyonları nedir,yaygin anksiyete bozuklugu
yes,gelen duygu ataklarına halen tepki vermemeyi ögrenemedigim bok rahatsızlık. duygu katlandıkça katlanıyor.,yaygin anksiyete bozuklugu
yes,"korktuğun şeyler o kadar fazla, hayatın o kadar kısıtlanmıştır ki, ileri derecede engelli biri gibisindir. ... her boktan korkuyorsundur. ... yaygın anksiyete bozukluğu.",yaygin anksiyete bozuklugu
yes,"iki üç haftalığına istanbul'da yaşayan ablamın yanına gittim... iki ay önce xanaxla yaşayıp gecede üç kere acile kaldırılıyordum. terapi, ilaç ve çevre değişikliği ile birlikte şimdilik atlattım gibi görünüyor.",yaygin anksiyete bozuklugu
yes,beyindeki kimyasal ve fiziksel bir bozukluk yatar.,yaygin anksiyete bozuklugu
yes,"evlenmeden önce asansöre tek başına binememeler bensiz bir yere gitmek istememeler, evliliğin ilk başlarında kadınların çoğu bu şekilde psikolojik sıkıntılar yaşayabilir, anksiyete ataklarına şahit oldum, metro, metrobüs, uçak, tren, feribot gibi toplu taşıtların hepsinde ölecek gibi davranmaya başladı, sonrasında yemek yerken yutamamalar, geçen vücut ağrıları, bazen onun uykusunda bilinçsiz olarak yakamdan tuttuğuna şahit oldum,.normal konuşacak bir konu bulamıyorum, kendi çevresinde dostu kalmadı, neşem bitti.",yaygin anksiyete bozuklugu
yes,"içindekilerinize karşı duyarlı, empati sahibi, içine kapanık, aşırı utangaç, hafif yaş aldıkça içine kapanık ve utangaç halim çevremde sorun oluşturmaya başladı. yaygın anksiyete bozukluğunda uzanmak ve dinlenmek kafada beşşüz sekme açıkken mümkün görünmüyor. doktora da dikkat dağınıklığı, tahammülsüzlük, agresyon, çarpıntı, kafada senaryolar kurup kurduğum senaryoların saçmalığına rağmen onlardan kurtulamama ve benzeri şikayetlerle başvurdum.",yaygin anksiyete bozuklugu
yes,"milleti uykusundan uyandırıyor,beni uyutmuyor bile..",yaygin anksiyete bozuklugu
